{
  "title": "Report Generation",
  "timestamp_utc": "2026-03-05T23:11:30.231174+00:00",
  "query": "generate markdown report and writeup from project notes and artifacts",
  "session_id": null,
  "log_lines_used": 3,
  "evidence_items": 0,
  "output": "/workspace/data/projects/demo/report/auto_report.md"
}