{
  "title": "Report Generation",
  "timestamp_utc": "2026-03-05T19:47:28.043841+00:00",
  "query": "writeup project smoke-compose",
  "session_id": null,
  "log_lines_used": 0,
  "evidence_items": 0,
  "output": "/mnt/c/Users/david/OneDrive - Pontificia Universidad Javeriana/Documents/GitHub/ai-cyber-lab/data/projects/smoke-compose/report/auto_report.md"
}