{
  "title": "Report Generation",
  "timestamp_utc": "2026-03-05T17:52:26.699104+00:00",
  "query": "writeup project demo",
  "session_id": null,
  "log_lines_used": 0,
  "evidence_items": 0,
  "output": "/mnt/c/Users/david/OneDrive - Pontificia Universidad Javeriana/Documents/GitHub/ai-cyber-lab/data/projects/demo/report/auto_report.md"
}